{
  "benchmark_version": "v0.2",
  "instance_id": "graph_bfs_shortest_path_002",
  "system_id": "text_only_v1",
  "domain": "graph",
  "difficulty": "easy",
  "instance_path": "benchmark/v0.2/instances/graph/graph_bfs_shortest_path_002",
  "generated_output_path": "runs/run_2026_04_22_text_only_v1_eval_003/generated/text_only_v1/graph_bfs_shortest_path_002.json",
  "informal_statement": {
    "text": "Given an unweighted directed graph represented by an adjacency list of n vertices and a source vertex, return a vector dist of length n where dist[v] is Some(k) if the shortest path from source to v uses k edges, and None if v is unreachable.",
    "preconditions": [
      "n >= 1",
      "0 <= source < n",
      "every neighbor index is in [0, n)"
    ],
    "required_properties": [
      "dist has length n",
      "dist[source] == Some(0)",
      "if dist[v] == Some(k), there is a directed path from source to v using exactly k edges",
      "if dist[v] == Some(k), no directed path from source to v uses fewer than k edges",
      "if dist[v] == None, there is no directed path from source to v"
    ],
    "edge_cases": [
      "graph with a single vertex and no edges",
      "fully disconnected graph (source isolated)",
      "cycles on the shortest path",
      "parallel edges (duplicate neighbors)",
      "self-loop on the source"
    ]
  },
  "semantic_units": [
    {
      "id": "SU1",
      "description": "Length invariant: dist has length n, equal to the number of vertices.",
      "criticality": "critical",
      "common_failure_modes": [
        "omitting the length constraint",
        "stating an upper bound instead of equality"
      ]
    },
    {
      "id": "SU2",
      "description": "Source anchor: dist[source] = Some(0).",
      "criticality": "critical",
      "common_failure_modes": [
        "forgetting to anchor the source distance",
        "allowing dist[source] = Some(k) for k > 0"
      ]
    },
    {
      "id": "SU3",
      "description": "Reachability witness: if dist[v] = Some(k), there is a directed path from source to v using exactly k edges.",
      "criticality": "critical",
      "common_failure_modes": [
        "omitting the existential witness",
        "stating the weaker 'v is reachable' without length"
      ]
    },
    {
      "id": "SU4",
      "description": "Minimality: if dist[v] = Some(k), no path uses fewer than k edges.",
      "criticality": "critical",
      "common_failure_modes": [
        "confusing the minimal and any-path formulations"
      ]
    },
    {
      "id": "SU5",
      "description": "Unreachability: dist[v] = None iff no path exists from source to v.",
      "criticality": "critical",
      "common_failure_modes": [
        "only stating one direction of the iff",
        "conflating 'no path' with 'path of length > bound'"
      ]
    }
  ],
  "reference_obligations": [
    {
      "id": "obl_001",
      "kind": "postcondition",
      "lean_statement": "∀ (adj : Adj) (src : Nat), (bfsShortestPath adj src).length = adj.length",
      "nl_gloss": "The output has the same length as the number of vertices.",
      "linked_semantic_units": [
        "SU1"
      ],
      "importance": "critical",
      "proof_relevance": "direct"
    },
    {
      "id": "obl_002",
      "kind": "postcondition",
      "lean_statement": "∀ (adj : Adj) (src : Nat), src < adj.length → (bfsShortestPath adj src).get? src = some (some 0)",
      "nl_gloss": "The distance from the source to itself is zero.",
      "linked_semantic_units": [
        "SU2"
      ],
      "importance": "critical",
      "proof_relevance": "direct"
    },
    {
      "id": "obl_003",
      "kind": "postcondition",
      "lean_statement": "∀ (adj : Adj) (src v k : Nat), (bfsShortestPath adj src).get? v = some (some k) → ∃ path : List Nat, path.head? = some src ∧ path.getLast? = some v ∧ path.length = k + 1",
      "nl_gloss": "If dist[v] = Some(k), there is a path from source to v with exactly k edges.",
      "linked_semantic_units": [
        "SU3"
      ],
      "importance": "critical",
      "proof_relevance": "direct"
    },
    {
      "id": "obl_004",
      "kind": "postcondition",
      "lean_statement": "∀ (adj : Adj) (src v k : Nat), (bfsShortestPath adj src).get? v = some (some k) → ∀ (path : List Nat), path.head? = some src → path.getLast? = some v → k + 1 ≤ path.length",
      "nl_gloss": "If dist[v] = Some(k), no path from source to v has fewer than k edges.",
      "linked_semantic_units": [
        "SU4"
      ],
      "importance": "critical",
      "proof_relevance": "direct"
    },
    {
      "id": "obl_005",
      "kind": "postcondition",
      "lean_statement": "∀ (adj : Adj) (src v : Nat), (bfsShortestPath adj src).get? v = some none ↔ ¬ ∃ (path : List Nat), path.head? = some src ∧ path.getLast? = some v",
      "nl_gloss": "dist[v] = None if and only if no path from source to v exists.",
      "linked_semantic_units": [
        "SU5"
      ],
      "importance": "critical",
      "proof_relevance": "direct"
    }
  ],
  "generated_obligations": [
    {
      "index": 0,
      "kind": "unknown",
      "lean_statement": "∀ (n : Nat) (adj : Fin n → List (Fin n)) (s : Fin n),\n  let dist := bfsDist adj s\n  dist.length = n",
      "nl_gloss": "The returned distance vector has length n (one entry per vertex).",
      "linked_semantic_units": [],
      "raw_source": "model"
    },
    {
      "index": 1,
      "kind": "unknown",
      "lean_statement": "∀ (n : Nat) (adj : Fin n → List (Fin n)) (s : Fin n) (v : Fin n),\n  let dist := bfsDist adj s\n  dist[v].isSome ∨ dist[v].isNone",
      "nl_gloss": "For every vertex v, the algorithm returns either Some(k) or None at dist[v].",
      "linked_semantic_units": [],
      "raw_source": "model"
    },
    {
      "index": 2,
      "kind": "unknown",
      "lean_statement": "∀ (n : Nat) (adj : Fin n → List (Fin n)) (s v : Fin n),\n  let dist := bfsDist adj s\n  (∃ k : Nat, shortestPathEdges adj s v = some k) →\n    ∃ k : Nat, dist[v] = some k ∧ k = shortestPathEdges adj s v |> Option.get (by simp [shortestPathEdges])",
      "nl_gloss": "If v is reachable and the shortest path uses k edges, then dist[v] is Some(k).",
      "linked_semantic_units": [],
      "raw_source": "model"
    },
    {
      "index": 3,
      "kind": "unknown",
      "lean_statement": "∀ (n : Nat) (adj : Fin n → List (Fin n)) (s v : Fin n),\n  let dist := bfsDist adj s\n  ∀ k : Nat,\n    dist[v] = some k →\n      (∃ path : List (Fin n),\n        path.head? = some s ∧ path.last? = some v ∧\n        pathEdges adj path ∧ path.length - 1 = k) ∧\n      (∀ k' : Nat,\n        (∃ path' : List (Fin n),\n          path'.head? = some s ∧ path'.last? = some v ∧\n          pathEdges adj path' ∧ path'.length - 1 = k') → k ≤ k')",
      "nl_gloss": "If dist[v] = Some(k), then there exists a path from s to v using exactly k edges, and no path uses fewer than k edges.",
      "linked_semantic_units": [],
      "raw_source": "model"
    },
    {
      "index": 4,
      "kind": "unknown",
      "lean_statement": "∀ (n : Nat) (adj : Fin n → List (Fin n)) (s v : Fin n),\n  let dist := bfsDist adj s\n  (¬ ∃ k : Nat, shortestPathEdges adj s v = some k) →\n    dist[v] = none",
      "nl_gloss": "If there is no path from s to v, then dist[v] is None.",
      "linked_semantic_units": [],
      "raw_source": "model"
    },
    {
      "index": 5,
      "kind": "unknown",
      "lean_statement": "∀ (n : Nat) (adj : Fin n → List (Fin n)) (s : Fin n),\n  let dist := bfsDist adj s\n  dist[s] = some 0",
      "nl_gloss": "The distance from the source to itself is Some(0).",
      "linked_semantic_units": [],
      "raw_source": "model"
    }
  ],
  "lean_check": {
    "elaborated": null,
    "diagnostics_path": "benchmark/v0.2/annotation/review_packets/text_only_v1/graph_bfs_shortest_path_002/lean_diagnostics.json"
  },
  "behavior_check": {
    "report_path": "benchmark/v0.2/annotation/review_packets/text_only_v1/graph_bfs_shortest_path_002/behavior_report.json",
    "summary": {
      "has_counterexample": false,
      "counterexample_count": 0
    }
  },
  "context": {
    "scaffold_path": "benchmark/v0.2/annotation/review_packets/text_only_v1/graph_bfs_shortest_path_002/scaffold.lean",
    "reference_rs_path": "benchmark/v0.2/annotation/review_packets/text_only_v1/graph_bfs_shortest_path_002/reference.rs",
    "rust_summary_path": "benchmark/v0.2/annotation/review_packets/text_only_v1/graph_bfs_shortest_path_002/rust_summary.json"
  }
}