{
  "benchmark_version": "v0.2",
  "instance_id": "dp_knapsack_01_002",
  "system_id": "code_only_v1",
  "domain": "dp",
  "difficulty": "medium",
  "instance_path": "benchmark/v0.2/instances/dp/dp_knapsack_01_002",
  "generated_output_path": "runs/run_2026_04_22_code_only_v1_eval_zzzzz_full_refresh_001/generated/code_only_v1/dp_knapsack_01_002.json",
  "informal_statement": {
    "text": "Given equal-length slices of non-negative item weights and item values, and a non-negative integer capacity, return the maximum total value achievable by choosing a subset whose total weight does not exceed the capacity. Each item may be selected at most once.",
    "preconditions": [
      "weights and values have the same length",
      "every weight is a non-negative integer",
      "every value is a non-negative integer",
      "capacity is a non-negative integer"
    ],
    "required_properties": [
      "the result is witnessed by some subset S of item indices whose total weight <= capacity and total value equals the result",
      "no subset whose total weight <= capacity has a strictly greater total value",
      "each item index is used at most once in any witness subset"
    ],
    "edge_cases": [
      "empty input (result is 0)",
      "capacity 0 (result is 0 unless there is a zero-weight positive-value item)",
      "a single item with weight > capacity",
      "multiple items of identical weight and value",
      "all weights exceeding capacity"
    ]
  },
  "semantic_units": [
    {
      "id": "SU1",
      "description": "Alignment precondition: weights and values have the same length.",
      "criticality": "critical",
      "common_failure_modes": [
        "omitting the length alignment",
        "allowing trailing values to be ignored"
      ]
    },
    {
      "id": "SU2",
      "description": "Capacity feasibility: the witness subset has total weight at most the capacity.",
      "criticality": "critical",
      "common_failure_modes": [
        "dropping the capacity constraint",
        "applying strict inequality"
      ]
    },
    {
      "id": "SU3",
      "description": "Value witness: there is a valid selection whose total value equals the returned result.",
      "criticality": "critical",
      "common_failure_modes": [
        "stating only a value upper bound"
      ]
    },
    {
      "id": "SU4",
      "description": "Optimality: no valid selection with total weight <= capacity achieves a strictly greater total value.",
      "criticality": "critical",
      "common_failure_modes": [
        "stating only the witness (admits 'return 0')",
        "reducing to unbounded knapsack (allowing repeats)"
      ]
    },
    {
      "id": "SU5",
      "description": "0/1 uniqueness: items appear at most once in any witness selection.",
      "criticality": "supporting",
      "common_failure_modes": [
        "allowing multiplicities (unbounded knapsack)"
      ]
    }
  ],
  "reference_obligations": [
    {
      "id": "obl_001",
      "kind": "postcondition",
      "lean_statement": "∀ (ws : Weights) (vs : Values) (cap : Nat), ws.length = vs.length → ∃ (sel : Selection), ValidSelection ws sel ∧ totalWeight ws sel ≤ cap ∧ totalValue vs sel = knapsack01 ws vs cap",
      "nl_gloss": "When weights and values are length-aligned, there exists a valid feasible selection whose total value equals the returned result.",
      "linked_semantic_units": [
        "SU1",
        "SU2",
        "SU3",
        "SU5"
      ],
      "importance": "critical",
      "proof_relevance": "direct"
    },
    {
      "id": "obl_002",
      "kind": "postcondition",
      "lean_statement": "∀ (ws : Weights) (vs : Values) (cap : Nat) (sel : Selection), ws.length = vs.length → ValidSelection ws sel → totalWeight ws sel ≤ cap → totalValue vs sel ≤ knapsack01 ws vs cap",
      "nl_gloss": "When weights and values are length-aligned, no valid feasible selection beats the returned result.",
      "linked_semantic_units": [
        "SU4"
      ],
      "importance": "critical",
      "proof_relevance": "direct"
    }
  ],
  "generated_obligations": [
    {
      "index": 0,
      "kind": "postcondition",
      "layer": "benchmark_facing",
      "lean_statement": "theorem SU1_feasible_witness (ws : Weights) (vs : Values) (cap : Nat)\n  (hal : ws.length = vs.length) :\n  ∃ sel : Selection,\n    ValidSelection ws sel ∧\n    totalWeight ws sel ≤ cap ∧\n    totalValue vs sel = knapsack01 ws vs cap := by\n  exact knapsack01_feasible_witness ws vs cap hal",
      "nl_gloss": "When weights and values align, some valid selection achieves the returned optimum within the capacity.",
      "linked_semantic_units": [
        "SU1",
        "SU2",
        "SU3",
        "SU5"
      ],
      "raw_source": "model"
    },
    {
      "index": 1,
      "kind": "postcondition",
      "layer": "benchmark_facing",
      "lean_statement": "theorem SU4_global_optimal (ws : Weights) (vs : Values) (cap : Nat) (sel : Selection)\n  (hal : ws.length = vs.length)\n  (hv : ValidSelection ws sel)\n  (hw : totalWeight ws sel ≤ cap) :\n  totalValue vs sel ≤ knapsack01 ws vs cap := by\n  exact totalValue_le_knapsack01 ws vs cap hal sel hv hw",
      "nl_gloss": "No feasible selection within the capacity beats the returned optimum.",
      "linked_semantic_units": [
        "SU4"
      ],
      "raw_source": "model"
    },
    {
      "index": 2,
      "kind": "postcondition",
      "layer": "benchmark_facing",
      "lean_statement": "theorem knapsack01_valid_selection_nodup (weights : Weights) (sel : Selection)\n  (hV : ValidSelection weights sel) : sel.Nodup := by\n  exact hV.1",
      "nl_gloss": "Any valid selection is 0/1 at the index level: indices are distinct (Nodup is part of ValidSelection).",
      "linked_semantic_units": [
        "SU5"
      ],
      "raw_source": "model"
    }
  ],
  "quality_summary": {
    "critical_units_covered_by_direct_theorems": [
      "SU1",
      "SU2",
      "SU3",
      "SU4"
    ],
    "critical_units_only_indirectly_covered": [],
    "off_spec_theorems_present": false,
    "vacuous_theorems_present": false
  },
  "lean_check": {
    "elaborated": true,
    "diagnostics_path": "benchmark/v0.2/annotation/review_packets/code_only_v1/dp_knapsack_01_002/lean_diagnostics.json",
    "admit_count": 0,
    "axiom_dependencies": [],
    "proof_mode": "definition_backed"
  },
  "behavior_check": {
    "report_path": "benchmark/v0.2/annotation/review_packets/code_only_v1/dp_knapsack_01_002/behavior_report.json",
    "summary": {
      "has_counterexample": false,
      "counterexample_count": 0
    }
  },
  "context": {
    "scaffold_path": "benchmark/v0.2/annotation/review_packets/code_only_v1/dp_knapsack_01_002/scaffold.lean",
    "reference_rs_path": "benchmark/v0.2/annotation/review_packets/code_only_v1/dp_knapsack_01_002/reference.rs",
    "rust_summary_path": "benchmark/v0.2/annotation/review_packets/code_only_v1/dp_knapsack_01_002/rust_summary.json"
  }
}