{
  "benchmark_version": "v0.2",
  "instance_id": "greedy_coin_change_canonical_001",
  "system_id": "code_only_v1",
  "domain": "greedy",
  "difficulty": "easy",
  "instance_path": "benchmark/v0.2/instances/greedy/greedy_coin_change_canonical_001",
  "generated_output_path": "runs/run_2026_04_23_code_only_v1_eval_zzzzzzzzzzzz_902/generated/code_only_v1/greedy_coin_change_canonical_001.json",
  "informal_statement": {
    "text": "Given a sorted-ascending slice of positive integer coin denominations that forms a canonical system (greedy is optimal), and a non-negative target amount, return a vector `counts` of the same length as the denominations such that `sum(counts[i] * denoms[i]) == amount` and `sum(counts)` is the minimum possible over all such vectors.",
    "preconditions": [
      "denoms is sorted strictly ascending",
      "denoms[0] == 1",
      "every denomination is a positive integer",
      "the denomination system is canonical (greedy yields the optimum)",
      "amount >= 0"
    ],
    "required_properties": [
      "counts has the same length as denoms",
      "sum over i of counts[i] * denoms[i] equals amount",
      "sum of counts is minimum over all valid decompositions",
      "every counts[i] is non-negative"
    ],
    "edge_cases": [
      "amount == 0 (all zero counts)",
      "amount exactly equal to a denomination",
      "amount smaller than the second-smallest denomination",
      "very large amount requiring many units of the penny",
      "denoms of length 1 ([1])"
    ]
  },
  "semantic_units": [
    {
      "id": "SU1",
      "description": "Canonicality precondition: the denomination system must be canonical (greedy yields the optimal count).",
      "criticality": "critical",
      "common_failure_modes": [
        "omitting the canonicality precondition",
        "assuming greedy is always optimal for any denomination system"
      ]
    },
    {
      "id": "SU2",
      "description": "Alignment: the output counts vector has the same length as denoms.",
      "criticality": "supporting",
      "common_failure_modes": [
        "returning a variable-length vector",
        "dropping trailing zero entries"
      ]
    },
    {
      "id": "SU3",
      "description": "Decomposition: sum(counts[i] * denoms[i]) equals amount.",
      "criticality": "critical",
      "common_failure_modes": [
        "stating sum(counts) = amount instead of the weighted sum"
      ]
    },
    {
      "id": "SU4",
      "description": "Optimality: sum(counts) is minimal among all valid decompositions.",
      "criticality": "critical",
      "common_failure_modes": [
        "stating only feasibility; admits the zero-count no-op on amount=0 but not in general"
      ]
    },
    {
      "id": "SU5",
      "description": "Non-negativity: every count entry is non-negative.",
      "criticality": "supporting"
    }
  ],
  "reference_obligations": [
    {
      "id": "obl_001",
      "kind": "postcondition",
      "lean_statement": "\u2200 (denoms : Denoms) (amt : Nat), (coinChangeCanonical denoms amt).length = denoms.length",
      "nl_gloss": "The returned counts vector aligns with the denomination vector.",
      "linked_semantic_units": [
        "SU2"
      ],
      "importance": "supporting",
      "proof_relevance": "auxiliary"
    },
    {
      "id": "obl_002",
      "kind": "postcondition",
      "lean_statement": "\u2200 (denoms : Denoms) (amt : Nat), Decomposes denoms (coinChangeCanonical denoms amt) amt",
      "nl_gloss": "The returned counts decompose the target amount.",
      "linked_semantic_units": [
        "SU3"
      ],
      "importance": "critical",
      "proof_relevance": "direct"
    },
    {
      "id": "obl_003",
      "kind": "postcondition",
      "lean_statement": "\u2200 (denoms : Denoms) (amt : Nat) (alt : Counts), Canonical denoms \u2192 Decomposes denoms alt amt \u2192 (coinChangeCanonical denoms amt).sum \u2264 alt.sum",
      "nl_gloss": "When the denomination system is canonical, the greedy count sum is at most any competing valid decomposition's sum.",
      "linked_semantic_units": [
        "SU1",
        "SU4"
      ],
      "importance": "critical",
      "proof_relevance": "direct"
    }
  ],
  "generated_obligations": [
    {
      "index": 0,
      "kind": "postcondition",
      "layer": "benchmark_facing",
      "lean_statement": "theorem SU2_alignment (denoms : List Nat) (amount : Nat) : (coin_change_canonical denoms amount).length = denoms.length",
      "nl_gloss": "Counts vector aligns with denominations.",
      "linked_semantic_units": [
        "SU2"
      ],
      "raw_source": "model"
    },
    {
      "index": 1,
      "kind": "postcondition",
      "layer": "benchmark_facing",
      "lean_statement": "theorem SU3_weighted_sum (denoms : List Nat) (amount : Nat) : dot_product (coin_change_canonical denoms amount) denoms = amount",
      "nl_gloss": "Weighted sum equals amount.",
      "linked_semantic_units": [
        "SU3"
      ],
      "raw_source": "model"
    },
    {
      "index": 2,
      "kind": "postcondition",
      "layer": "benchmark_facing",
      "lean_statement": "theorem SU5_nonnegative_counts (denoms : List Nat) (amount : Nat) : ? c ? coin_change_canonical denoms amount, 0 = c",
      "nl_gloss": "All counts are non-negative.",
      "linked_semantic_units": [
        "SU5"
      ],
      "raw_source": "model"
    },
    {
      "index": 3,
      "kind": "optimality",
      "layer": "benchmark_facing",
      "lean_statement": "theorem SU4_optimality_under_canonicality (denoms : List Nat) (amount : Nat) (hcanon : CanonicalDenoms denoms) :\n  let counts := coin_change_canonical denoms amount\n  ? counts' : List Nat, counts'.length = denoms.length ? dot_product counts' denoms = amount ? sum counts = sum counts'",
      "nl_gloss": "Optimality is explicit and conditional on canonicality.",
      "linked_semantic_units": [
        "SU1",
        "SU4"
      ],
      "raw_source": "model"
    }
  ],
  "quality_summary": {
    "critical_units_covered_by_direct_theorems": [
      "SU1",
      "SU3",
      "SU4"
    ],
    "critical_units_only_indirectly_covered": [],
    "off_spec_theorems_present": false,
    "vacuous_theorems_present": false
  },
  "lean_check": {
    "elaborated": null,
    "diagnostics_path": "benchmark/v0.2/annotation/review_packets/code_only_v1/greedy_coin_change_canonical_001/lean_diagnostics.json"
  },
  "behavior_check": {
    "report_path": "benchmark/v0.2/annotation/review_packets/code_only_v1/greedy_coin_change_canonical_001/behavior_report.json",
    "summary": {
      "has_counterexample": false,
      "counterexample_count": 0
    }
  },
  "context": {
    "scaffold_path": "benchmark/v0.2/annotation/review_packets/code_only_v1/greedy_coin_change_canonical_001/scaffold.lean",
    "reference_rs_path": "benchmark/v0.2/annotation/review_packets/code_only_v1/greedy_coin_change_canonical_001/reference.rs",
    "rust_summary_path": "benchmark/v0.2/annotation/review_packets/code_only_v1/greedy_coin_change_canonical_001/rust_summary.json"
  }
}
