{
  "benchmark_version": "v0.2",
  "instance_id": "arrays_binary_search_001",
  "system_id": "code_only_v1",
  "domain": "arrays",
  "difficulty": "easy",
  "instance_path": "benchmark/v0.2/instances/arrays/arrays_binary_search_001",
  "generated_output_path": "runs/run_2026_04_22_code_only_v1_eval_zzzzz_full_refresh_001/generated/code_only_v1/arrays_binary_search_001.json",
  "informal_statement": {
    "text": "Given a sorted slice of integers in nondecreasing order and a target value, return Some(i) where arr[i] == target, or None if the target is absent. If multiple indices match, returning any valid index is acceptable.",
    "preconditions": [
      "arr is sorted in nondecreasing order"
    ],
    "required_properties": [
      "if the function returns Some(i), then i < arr.len() and arr[i] == target",
      "if the function returns None, then target does not occur in arr",
      "the function terminates for every input"
    ],
    "edge_cases": [
      "empty slice",
      "single-element slice containing the target",
      "single-element slice not containing the target",
      "target smaller than all elements",
      "target larger than all elements",
      "duplicates of the target"
    ]
  },
  "semantic_units": [
    {
      "id": "SU1",
      "description": "Input precondition: the slice is sorted in nondecreasing order.",
      "criticality": "critical",
      "common_failure_modes": [
        "forgetting the precondition entirely",
        "asserting strict ordering instead of nondecreasing"
      ]
    },
    {
      "id": "SU2",
      "description": "Success postcondition: if the return is Some(i), then i is a valid index and arr[i] == target.",
      "criticality": "critical",
      "common_failure_modes": [
        "omitting the bounds check",
        "omitting the equality check"
      ]
    },
    {
      "id": "SU3",
      "description": "Failure postcondition: if the return is None, then target does not occur in arr.",
      "criticality": "critical",
      "common_failure_modes": [
        "only quantifying over a prefix or suffix",
        "stating the weaker claim that target is not at a specific position"
      ]
    },
    {
      "id": "SU4",
      "description": "Termination: the function terminates on every input (lo..hi shrinks each iteration).",
      "criticality": "supporting",
      "common_failure_modes": [
        "stating termination without a variant"
      ]
    },
    {
      "id": "SU5",
      "description": "Uniqueness is NOT required: multiple valid indices exist when duplicates are present.",
      "criticality": "optional"
    }
  ],
  "reference_obligations": [
    {
      "id": "obl_001",
      "kind": "postcondition",
      "lean_statement": "∀ (arr : Arr) (t : Int) (i : Nat), binarySearch arr t = some i → i < arr.length ∧ arr.get? i = some t",
      "nl_gloss": "If the function returns Some i, then i is in range and arr[i] equals the target.",
      "linked_semantic_units": [
        "SU2"
      ],
      "importance": "critical",
      "proof_relevance": "direct"
    },
    {
      "id": "obl_002",
      "kind": "postcondition",
      "lean_statement": "∀ (arr : Arr) (t : Int), SortedLE arr → binarySearch arr t = none → ∀ i, i < arr.length → arr.get? i ≠ some t",
      "nl_gloss": "Assuming the input is sorted in nondecreasing order, if the function returns None then the target does not occur anywhere in the slice.",
      "linked_semantic_units": [
        "SU1",
        "SU3"
      ],
      "importance": "critical",
      "proof_relevance": "direct"
    }
  ],
  "generated_obligations": [
    {
      "index": 0,
      "kind": "postcondition",
      "layer": "benchmark_facing",
      "lean_statement": "theorem SU2_success_index_and_value (arr : Arr) (target : Int) (hs : Sorted arr) (i : Nat) :\n  binarySearch arr target = some i → i < arr.length ∧ arr.get? i = some target",
      "nl_gloss": "Under sortedness, if the search returns Some i, then i is in bounds and the slice value at i equals the target.",
      "linked_semantic_units": [
        "SU1",
        "SU2"
      ],
      "raw_source": "model"
    },
    {
      "index": 1,
      "kind": "postcondition",
      "layer": "benchmark_facing",
      "lean_statement": "theorem SU3_failure_absent (arr : Arr) (target : Int)\n  (hs : Sorted arr) (h : binarySearch arr target = none) :\n  ∀ j, j < arr.length → arr.get? j ≠ some target",
      "nl_gloss": "Under sortedness, if the search returns None, then the target does not occur at any valid index.",
      "linked_semantic_units": [
        "SU1",
        "SU3"
      ],
      "raw_source": "model"
    }
  ],
  "quality_summary": {
    "critical_units_covered_by_direct_theorems": [
      "SU1",
      "SU2",
      "SU3"
    ],
    "critical_units_only_indirectly_covered": [],
    "off_spec_theorems_present": false,
    "vacuous_theorems_present": false
  },
  "lean_check": {
    "elaborated": null,
    "diagnostics_path": "benchmark/v0.2/annotation/review_packets/code_only_v1/arrays_binary_search_001/lean_diagnostics.json"
  },
  "behavior_check": {
    "report_path": "benchmark/v0.2/annotation/review_packets/code_only_v1/arrays_binary_search_001/behavior_report.json",
    "summary": {
      "has_counterexample": false,
      "counterexample_count": 0
    }
  },
  "context": {
    "scaffold_path": "benchmark/v0.2/annotation/review_packets/code_only_v1/arrays_binary_search_001/scaffold.lean",
    "reference_rs_path": "benchmark/v0.2/annotation/review_packets/code_only_v1/arrays_binary_search_001/reference.rs",
    "rust_summary_path": "benchmark/v0.2/annotation/review_packets/code_only_v1/arrays_binary_search_001/rust_summary.json"
  }
}