{
  "benchmark_version": "v0.2",
  "instance_id": "trees_lowest_common_ancestor_001",
  "system_id": "code_only_v1",
  "domain": "trees",
  "difficulty": "medium",
  "instance_path": "benchmark/v0.2/instances/trees/trees_lowest_common_ancestor_001",
  "generated_output_path": "runs/run_2026_04_23_code_only_v1_eval_zzzzzzzzzzzz_900/generated/code_only_v1/trees_lowest_common_ancestor_001.json",
  "informal_statement": {
    "text": "Given a binary search tree whose in-order traversal is strictly ascending and two keys both present in the tree, return the key of the lowest node that has both keys in its subtree.",
    "preconditions": [
      "the input tree is a valid BST",
      "both query keys are present in the tree"
    ],
    "required_properties": [
      "the returned key appears in the tree",
      "both query keys are in the subtree rooted at the returned key",
      "no proper descendant of the returned key has both query keys in its subtree"
    ],
    "edge_cases": [
      "both keys equal (returned key equals them)",
      "one key is an ancestor of the other",
      "keys on opposite sides of the root",
      "root is the LCA",
      "tree with only a single path"
    ]
  },
  "semantic_units": [
    {
      "id": "SU1",
      "description": "BST precondition: the input tree is a valid BST.",
      "criticality": "critical",
      "common_failure_modes": [
        "omitting the BST precondition and solving general-tree LCA",
        "assuming strict ordering within equal keys"
      ]
    },
    {
      "id": "SU2",
      "description": "Presence precondition: both query keys are present in the tree.",
      "criticality": "critical",
      "common_failure_modes": [
        "omitting the presence precondition",
        "returning None silently when a key is missing"
      ]
    },
    {
      "id": "SU3",
      "description": "Ancestor property: both query keys lie in the subtree rooted at the returned key.",
      "criticality": "critical",
      "common_failure_modes": [
        "returning any common ancestor instead of the lowest one",
        "confusing descendant with ancestor"
      ]
    },
    {
      "id": "SU4",
      "description": "Lowest: no proper descendant of the returned node contains both keys.",
      "criticality": "critical",
      "common_failure_modes": [
        "returning the root unconditionally",
        "using LCA of general trees (parent-pointer style) semantics"
      ]
    },
    {
      "id": "SU5",
      "description": "Key equality case: when p == q, the LCA is that same key.",
      "criticality": "supporting"
    }
  ],
  "reference_obligations": [
    {
      "id": "obl_001",
      "kind": "postcondition",
      "lean_statement": "∀ (t : Tree) (p q a : Int), IsBst t → HasKey t p → HasKey t q → lcaBst t p q = some a → ∃ sub : Tree, IsSubtree sub t ∧ (match sub with | Tree.nil => False | Tree.node _ k _ => k = a) ∧ HasKey sub p ∧ HasKey sub q",
      "nl_gloss": "When the input is a BST containing both query keys, the returned key is the root of a subtree containing both queries.",
      "linked_semantic_units": [
        "SU1",
        "SU2",
        "SU3"
      ],
      "importance": "critical",
      "proof_relevance": "direct"
    },
    {
      "id": "obl_002",
      "kind": "postcondition",
      "lean_statement": "∀ (t : Tree) (p q a : Int), IsBst t → HasKey t p → HasKey t q → lcaBst t p q = some a → ∀ (sub : Tree), IsProperSubtree sub t → (match sub with | Tree.nil => True | Tree.node _ k _ => k = a → False) → HasKey sub p → HasKey sub q → False",
      "nl_gloss": "When the input is a BST containing both query keys, no proper subtree that is not rooted at the returned key contains both queries and sits strictly below the LCA.",
      "linked_semantic_units": [
        "SU4"
      ],
      "importance": "critical",
      "proof_relevance": "direct"
    },
    {
      "id": "obl_003",
      "kind": "postcondition",
      "lean_statement": "∀ (t : Tree) (p : Int), IsBst t → HasKey t p → lcaBst t p p = some p",
      "nl_gloss": "When the input is a BST containing the key, the LCA of a key with itself is that key.",
      "linked_semantic_units": [
        "SU5"
      ],
      "importance": "supporting",
      "proof_relevance": "auxiliary"
    }
  ],
  "generated_obligations": [
    {
      "index": 0,
      "kind": "postcondition",
      "layer": "benchmark_facing",
      "lean_statement": "theorem SU3_subtree_witness (t : Tree) (p q a : Int)\n  (hb : IsBst t) (hp : HasKey t p) (hq : HasKey t q)\n  (hl : lcaBst t p q = some a) :\n  ∃ sub : Tree,\n    IsSubtree sub t ∧\n    (match sub with\n     | Tree.nil => False\n     | Tree.node _ k _ => k = a) ∧\n    HasKey sub p ∧\n    HasKey sub q",
      "nl_gloss": "When the BST contains both keys, the returned key roots a subtree of t that still contains both queries.",
      "linked_semantic_units": [
        "SU1",
        "SU2",
        "SU3"
      ],
      "raw_source": "model"
    },
    {
      "index": 1,
      "kind": "optimality",
      "layer": "benchmark_facing",
      "lean_statement": "theorem SU4_lowestness (t : Tree) (p q a : Int)\n  (hb : IsBst t) (hp : HasKey t p) (hq : HasKey t q)\n  (hl : lcaBst t p q = some a) :\n  ∀ d : Tree,\n    IsProperSubtree d t →\n    (match d with\n     | Tree.nil => True\n     | Tree.node _ k _ => k = a → False) →\n    HasKey d p →\n    HasKey d q →\n    False",
      "nl_gloss": "No proper subtree strictly below the returned root can still contain both query keys.",
      "linked_semantic_units": [
        "SU4"
      ],
      "raw_source": "model"
    },
    {
      "index": 2,
      "kind": "postcondition",
      "layer": "auxiliary",
      "lean_statement": "theorem SU5_equal_keys (t : Tree) (p : Int)\n  (hb : IsBst t) (hp : HasKey t p) :\n  lcaBst t p p = some p",
      "nl_gloss": "When p equals q, the LCA is that shared key.",
      "linked_semantic_units": [
        "SU5"
      ],
      "raw_source": "model"
    }
  ],
  "quality_summary": {
    "critical_units_covered_by_direct_theorems": [
      "SU1",
      "SU2",
      "SU3",
      "SU4"
    ],
    "critical_units_only_indirectly_covered": [],
    "off_spec_theorems_present": false,
    "vacuous_theorems_present": false
  },
  "lean_check": {
    "elaborated": false,
    "diagnostics_path": "benchmark/v0.2/annotation/review_packets/code_only_v1/trees_lowest_common_ancestor_001/lean_diagnostics.json",
    "admit_count": 0,
    "axiom_dependencies": [],
    "proof_mode": "definition_backed"
  },
  "behavior_check": {
    "report_path": "benchmark/v0.2/annotation/review_packets/code_only_v1/trees_lowest_common_ancestor_001/behavior_report.json",
    "summary": {
      "has_counterexample": false,
      "counterexample_count": 0
    }
  },
  "context": {
    "scaffold_path": "benchmark/v0.2/annotation/review_packets/code_only_v1/trees_lowest_common_ancestor_001/scaffold.lean",
    "reference_rs_path": "benchmark/v0.2/annotation/review_packets/code_only_v1/trees_lowest_common_ancestor_001/reference.rs",
    "rust_summary_path": "benchmark/v0.2/annotation/review_packets/code_only_v1/trees_lowest_common_ancestor_001/rust_summary.json"
  }
}