{
  "benchmark_version": "v0.2",
  "instance_id": "trees_bst_insert_002",
  "system_id": "code_only_v1",
  "domain": "trees",
  "difficulty": "easy",
  "instance_path": "benchmark/v0.2/instances/trees/trees_bst_insert_002",
  "generated_output_path": "runs/run_2026_04_22_code_only_v1_eval_zzzzz_full_refresh_001/generated/code_only_v1/trees_bst_insert_002.json",
  "informal_statement": {
    "text": "Given a binary search tree whose in-order traversal is sorted strictly ascending and an integer key, return a new BST identical to the input on every existing key plus an additional node with the given key, unless the key is already present, in which case the tree is returned unchanged.",
    "preconditions": [
      "the input tree is a valid BST (in-order traversal is strictly ascending)"
    ],
    "required_properties": [
      "the output tree is a valid BST",
      "the multiset of keys in the output equals the multiset of keys in the input union {key} if the key was absent, else equals the multiset of keys in the input",
      "every key present in the input is also present in the output"
    ],
    "edge_cases": [
      "empty input tree",
      "single-node tree, key less than root",
      "single-node tree, key greater than root",
      "single-node tree, key equal to root (unchanged)",
      "left-leaning chain",
      "right-leaning chain"
    ]
  },
  "semantic_units": [
    {
      "id": "SU1",
      "description": "BST precondition: the input tree is a valid BST (in-order strictly ascending).",
      "criticality": "critical",
      "common_failure_modes": [
        "relaxing to nondecreasing (allowing duplicates)",
        "omitting the precondition"
      ]
    },
    {
      "id": "SU2",
      "description": "BST invariant preservation: the output tree is also a valid BST.",
      "criticality": "critical",
      "common_failure_modes": [
        "omitting invariant preservation",
        "asserting it only when the key is absent"
      ]
    },
    {
      "id": "SU3",
      "description": "Key-set change: the output's key multiset is the input's multiset union {key} if the key was absent, else equals the input's multiset.",
      "criticality": "critical",
      "common_failure_modes": [
        "asserting insertion regardless of duplicates (breaks BST uniqueness)",
        "asserting subset only"
      ]
    },
    {
      "id": "SU4",
      "description": "Duplicate no-op: inserting an existing key returns a tree with the same key multiset.",
      "criticality": "supporting",
      "common_failure_modes": [
        "allowing duplicates after insertion"
      ]
    }
  ],
  "reference_obligations": [
    {
      "id": "obl_001",
      "kind": "postcondition",
      "lean_statement": "∀ (t : Tree) (k : Int), IsBst t → IsBst (bstInsert t k)",
      "nl_gloss": "If the input tree is a valid BST, the output tree preserves the BST invariant.",
      "linked_semantic_units": [
        "SU1",
        "SU2"
      ],
      "importance": "critical",
      "proof_relevance": "direct"
    },
    {
      "id": "obl_002",
      "kind": "postcondition",
      "lean_statement": "∀ (t : Tree) (k : Int), IsBst t → (k ∈ keys t ∨ (keys (bstInsert t k)).Perm (k :: keys t))",
      "nl_gloss": "If the input tree is a valid BST and the key was absent, the output's keys are the input's keys plus the new key.",
      "linked_semantic_units": [
        "SU3"
      ],
      "importance": "critical",
      "proof_relevance": "direct"
    },
    {
      "id": "obl_003",
      "kind": "postcondition",
      "lean_statement": "∀ (t : Tree) (k : Int), IsBst t → k ∈ keys t → (keys (bstInsert t k)).Perm (keys t)",
      "nl_gloss": "If the input tree is a valid BST and the key was already present, the output's keys are a permutation of the input's.",
      "linked_semantic_units": [
        "SU4"
      ],
      "importance": "supporting",
      "proof_relevance": "auxiliary"
    }
  ],
  "generated_obligations": [
    {
      "index": 0,
      "kind": "postcondition",
      "layer": "benchmark_facing",
      "lean_statement": "theorem SU2_bst_preserved (t : Tree) (k : Int) (hb : IsBst t) :\n  IsBst (bstInsert t k)",
      "nl_gloss": "Strict BST validity is preserved after insertion.",
      "linked_semantic_units": [
        "SU1",
        "SU2"
      ],
      "raw_source": "model"
    },
    {
      "index": 1,
      "kind": "postcondition",
      "layer": "benchmark_facing",
      "lean_statement": "theorem SU3_keys_absent_insert (t : Tree) (k : Int)\n  (hb : IsBst t) (habs : k ∉ keys t) :\n  List.Perm (keys (bstInsert t k)) (k :: keys t)",
      "nl_gloss": "When the key is absent, the output key list is the input keys with one copy of the new key adjoined.",
      "linked_semantic_units": [
        "SU1",
        "SU3"
      ],
      "raw_source": "model"
    },
    {
      "index": 2,
      "kind": "postcondition",
      "layer": "benchmark_facing",
      "lean_statement": "theorem SU4_keys_present_unchanged (t : Tree) (k : Int)\n  (hb : IsBst t) (hp : k ∈ keys t) :\n  List.Perm (keys (bstInsert t k)) (keys t)",
      "nl_gloss": "When the key is already present, insertion is a no-op on the key multiset.",
      "linked_semantic_units": [
        "SU1",
        "SU4"
      ],
      "raw_source": "model"
    }
  ],
  "quality_summary": {
    "critical_units_covered_by_direct_theorems": [
      "SU1",
      "SU2",
      "SU3"
    ],
    "critical_units_only_indirectly_covered": [],
    "off_spec_theorems_present": false,
    "vacuous_theorems_present": false
  },
  "lean_check": {
    "elaborated": false,
    "diagnostics_path": "benchmark/v0.2/annotation/review_packets/code_only_v1/trees_bst_insert_002/lean_diagnostics.json",
    "admit_count": 0,
    "axiom_dependencies": [],
    "proof_mode": "definition_backed"
  },
  "behavior_check": {
    "report_path": "benchmark/v0.2/annotation/review_packets/code_only_v1/trees_bst_insert_002/behavior_report.json",
    "summary": {
      "has_counterexample": false,
      "counterexample_count": 0
    }
  },
  "context": {
    "scaffold_path": "benchmark/v0.2/annotation/review_packets/code_only_v1/trees_bst_insert_002/scaffold.lean",
    "reference_rs_path": "benchmark/v0.2/annotation/review_packets/code_only_v1/trees_bst_insert_002/reference.rs",
    "rust_summary_path": "benchmark/v0.2/annotation/review_packets/code_only_v1/trees_bst_insert_002/rust_summary.json"
  }
}