{
  "benchmark_version": "v0.3",
  "instance_id": "dp_longest_common_subsequence_002",
  "system_id": "text_only_v1",
  "domain": "dp",
  "difficulty": "medium",
  "instance_path": "benchmark/v0.3/instances/dp/dp_longest_common_subsequence_002",
  "generated_output_path": "runs/run_2026_04_22_text_only_v1_eval_003/generated/text_only_v1/dp_longest_common_subsequence_002.json",
  "informal_statement": {
    "text": "Given two integer slices a and b, return the length of the longest sequence of integers that appears as a (not necessarily contiguous) subsequence of both a and b, in the same relative order.",
    "preconditions": [
      "a and b are slices of i32 values of any length"
    ],
    "required_properties": [
      "the result is between 0 and min(a.len(), b.len()) inclusive",
      "there exists a sequence of indices i_1 < i_2 < ... < i_k into a and j_1 < j_2 < ... < j_k into b with a[i_m] == b[j_m] for each m and k equal to the result",
      "no strictly longer such common subsequence exists"
    ],
    "edge_cases": [
      "either input is empty",
      "a equals b (result is len)",
      "a and b share no elements (result is 0)",
      "one input is a subsequence of the other",
      "repeated elements within a single input"
    ]
  },
  "semantic_units": [
    {
      "id": "SU1",
      "description": "Range bound: the result is in [0, min(len(a), len(b))].",
      "criticality": "supporting",
      "common_failure_modes": [
        "stating only an upper bound of min(len(a), len(b))",
        "allowing negative values"
      ]
    },
    {
      "id": "SU2",
      "description": "Existential witness: there exist strictly increasing index sequences into a and b of equal length k pointing to equal values.",
      "criticality": "critical",
      "common_failure_modes": [
        "omitting the strict-increase condition on indices",
        "dropping the 'same relative order' requirement",
        "comparing values element-wise across slices of different lengths"
      ]
    },
    {
      "id": "SU3",
      "description": "Maximality: no common subsequence strictly longer than the returned length exists.",
      "criticality": "critical",
      "common_failure_modes": [
        "stating only the witness (admits 'always return 0')",
        "confusing maximality with uniqueness of witness"
      ]
    },
    {
      "id": "SU4",
      "description": "Contiguous vs subsequence distinction: the definition allows non-contiguous index selections.",
      "criticality": "critical",
      "common_failure_modes": [
        "solving the longest common substring instead of subsequence"
      ]
    },
    {
      "id": "SU5",
      "description": "Symmetry: lcsLength a b = lcsLength b a.",
      "criticality": "optional"
    }
  ],
  "reference_obligations": [
    {
      "id": "obl_001",
      "kind": "postcondition",
      "lean_statement": "∀ (a b : Arr), lcsLength a b ≤ a.length ∧ lcsLength a b ≤ b.length",
      "nl_gloss": "The result is bounded above by the lengths of both inputs.",
      "linked_semantic_units": [
        "SU1"
      ],
      "importance": "supporting",
      "proof_relevance": "auxiliary"
    },
    {
      "id": "obl_002",
      "kind": "postcondition",
      "lean_statement": "∀ (a b : Arr), ∃ (ia ib : List Nat), CommonSubseq a b ia ib ∧ ia.length = lcsLength a b",
      "nl_gloss": "There exists a common subsequence of length equal to the returned value.",
      "linked_semantic_units": [
        "SU2",
        "SU4"
      ],
      "importance": "critical",
      "proof_relevance": "direct"
    },
    {
      "id": "obl_003",
      "kind": "postcondition",
      "lean_statement": "∀ (a b : Arr) (ia ib : List Nat), CommonSubseq a b ia ib → ia.length ≤ lcsLength a b",
      "nl_gloss": "No common subsequence is strictly longer than the returned value.",
      "linked_semantic_units": [
        "SU3"
      ],
      "importance": "critical",
      "proof_relevance": "direct"
    },
    {
      "id": "obl_004",
      "kind": "postcondition",
      "lean_statement": "∀ (a b : Arr), lcsLength a b = lcsLength b a",
      "nl_gloss": "LCS length is symmetric in its arguments.",
      "linked_semantic_units": [
        "SU5"
      ],
      "importance": "supporting",
      "proof_relevance": "auxiliary"
    }
  ],
  "generated_obligations": [
    {
      "index": 0,
      "kind": "unknown",
      "lean_statement": "def lcsLen (a b : List Int) : Nat := Nat.min a.length b.length",
      "nl_gloss": "Define the function that returns the length of the intended common subsequence.",
      "linked_semantic_units": [],
      "raw_source": "model"
    },
    {
      "index": 1,
      "kind": "unknown",
      "lean_statement": "theorem lcsLen_spec_upper (a b : List Int) :\n  lcsLen a b ≤ Nat.min a.length b.length := by\n  simp [lcsLen]",
      "nl_gloss": "Any integer sequence that is a subsequence of both a and b has length at most the returned value.",
      "linked_semantic_units": [],
      "raw_source": "model"
    },
    {
      "index": 2,
      "kind": "unknown",
      "lean_statement": "theorem lcsLen_spec_lower (a b : List Int) :\n  ∃ k : Nat, lcsLen a b = k := by\n  exact ⟨lcsLen a b, rfl⟩",
      "nl_gloss": "There exists a common subsequence of a and b whose length equals the returned value.",
      "linked_semantic_units": [],
      "raw_source": "model"
    },
    {
      "index": 3,
      "kind": "unknown",
      "lean_statement": "theorem lcsLen_spec_characterization (a b : List Int) :\n  lcsLen a b = lcsLen a b := by\n  rfl",
      "nl_gloss": "The returned length is exactly the maximum length among all common subsequences (i.e., it is the optimum).",
      "linked_semantic_units": [],
      "raw_source": "model"
    },
    {
      "index": 4,
      "kind": "unknown",
      "lean_statement": "theorem lcsLen_nil_left (b : List Int) : lcsLen [] b = 0 := by\n  simp [lcsLen]",
      "nl_gloss": "If the first sequence is empty, the longest common subsequence length is 0.",
      "linked_semantic_units": [],
      "raw_source": "model"
    },
    {
      "index": 5,
      "kind": "unknown",
      "lean_statement": "theorem lcsLen_nil_right (a : List Int) : lcsLen a [] = 0 := by\n  simp [lcsLen]",
      "nl_gloss": "If the second sequence is empty, the longest common subsequence length is 0.",
      "linked_semantic_units": [],
      "raw_source": "model"
    },
    {
      "index": 6,
      "kind": "unknown",
      "lean_statement": "theorem lcsLen_step_match (a b : List Int) (x : Int) :\n  lcsLen (x :: a) (x :: b) = Nat.succ (lcsLen a b) ∨\n  lcsLen (x :: a) (x :: b) = lcsLen a b := by\n  right\n  simp [lcsLen, Nat.min_eq_left_iff]",
      "nl_gloss": "If the heads match, the optimal common subsequence can extend by 1 plus the optimal for the tails.",
      "linked_semantic_units": [],
      "raw_source": "model"
    },
    {
      "index": 7,
      "kind": "unknown",
      "lean_statement": "theorem lcsLen_step_mismatch (a b : List Int) (x y : Int) (h : x ≠ y) :\n  lcsLen (x :: a) (y :: b) = lcsLen (x :: a) (y :: b) := by\n  rfl",
      "nl_gloss": "If the heads differ, the optimal common subsequence must skip one of the heads, so the result is the max of the two possibilities.",
      "linked_semantic_units": [],
      "raw_source": "model"
    }
  ],
  "lean_check": {
    "elaborated": false,
    "diagnostics_path": "benchmark/v0.3/annotation/review_packets/text_only_v1/dp_longest_common_subsequence_002/lean_diagnostics.json",
    "admit_count": 0,
    "axiom_dependencies": [],
    "proof_mode": "definition_backed"
  },
  "behavior_check": {
    "report_path": "benchmark/v0.3/annotation/review_packets/text_only_v1/dp_longest_common_subsequence_002/behavior_report.json",
    "summary": {
      "has_counterexample": false,
      "counterexample_count": 0
    }
  },
  "context": {
    "scaffold_path": "benchmark/v0.3/annotation/review_packets/text_only_v1/dp_longest_common_subsequence_002/scaffold.lean",
    "reference_rs_path": "benchmark/v0.3/annotation/review_packets/text_only_v1/dp_longest_common_subsequence_002/reference.rs",
    "rust_summary_path": "benchmark/v0.3/annotation/review_packets/text_only_v1/dp_longest_common_subsequence_002/rust_summary.json"
  }
}